{
  "certificate_version": "1.0.0",
  "proof_id": "V2XE036",
  "goal": "P036 -> P036",
  "context": {
    "domain": "hilbert-benchmark-v1",
    "rule_pack": "classical-hilbert-v1",
    "syntax": "hilbert-prop-ascii-v1",
    "generator": "llm-benchmark-v1"
  },
  "steps": [
    {
      "kind": "axiom",
      "axiom": "A1",
      "formula": "P036 -> (P036 -> P036)"
    },
    {
      "kind": "axiom",
      "axiom": "A2",
      "formula": "(P036 -> ((P036 -> P036) -> P036)) -> ((P036 -> (P036 -> P036)) -> (P036 -> P036))"
    },
    {
      "kind": "axiom",
      "axiom": "A1",
      "formula": "P036 -> ((P036 -> P036) -> P036)"
    },
    {
      "kind": "modus_ponens",
      "premises": [3, 2],
      "formula": "(P036 -> (P036 -> P036)) -> (P036 -> P036)"
    },
    {
      "kind": "modus_ponens",
      "premises": [1, 4],
      "formula": "P036 -> P036"
    }
  ]
}