{"certificate_version":"1.0.0","proof_id":"pilot_shared_20260327_NDI03","goal":"R","assumptions":["P","P -\u003e Q","Q -\u003e R"],"context":{"domain":"hilbert-benchmark-nd-v1","rule_pack":"classical-hilbert-v1","syntax":"hilbert-prop-ascii-v1","generator":"llm-benchmark-nd-v1+nd-to-hilbert-v1"},"steps":[{"kind":"assumption","assumption_ref":1,"formula":"P"},{"kind":"assumption","assumption_ref":2,"formula":"P -\u003e Q"},{"kind":"assumption","assumption_ref":3,"formula":"Q -\u003e R"},{"kind":"modus_ponens","premises":[1,2],"formula":"Q"},{"kind":"modus_ponens","premises":[4,3],"formula":"R"}]}