{
  "certificate_version": "1.0.0",
  "proof_id": "phase1_expanded_100_V2XE039",
  "goal": "S039",
  "context": {
    "domain": "hilbert-benchmark-v1",
    "rule_pack": "classical-hilbert-v1",
    "syntax": "hilbert-prop-ascii-v1",
    "generator": "llm-benchmark-v1"
  },
  "assumptions": [
    "P039",
    "P039 -> Q039",
    "Q039 -> R039",
    "R039 -> S039"
  ],
  "steps": [
    {
      "kind": "assumption",
      "formula": "P039",
      "assumption_ref": 1
    },
    {
      "kind": "assumption",
      "formula": "P039 -> Q039",
      "assumption_ref": 2
    },
    {
      "kind": "modus_ponens",
      "formula": "Q039",
      "premises": [1, 2]
    },
    {
      "kind": "assumption",
      "formula": "Q039 -> R039",
      "assumption_ref": 3
    },
    {
      "kind": "modus_ponens",
      "formula": "R039",
      "premises": [3, 4]
    },
    {
      "kind": "assumption",
      "formula": "R039 -> S039",
      "assumption_ref": 4
    },
    {
      "kind": "modus_ponens",
      "formula": "S039",
      "premises": [5, 6]
    }
  ]
}