{"certificate_version":"1.0.0","proof_id":"SGF02-M1","goal":"Q","context":{"domain":"hilbert-benchmark-v1","rule_pack":"classical-hilbert-v1","syntax":"hilbert-prop-ascii-v1","generator":"llm-benchmark-v1"},"assumptions":["P","P->Q"],"steps":[{"kind":"assumption","assumption_ref":1,"formula":"P"},{"kind":"assumption","assumption_ref":2,"formula":"P->Q"},{"kind":"modus_ponens","premises":[1,2],"formula":"Q"}]}