{
  "certificate_version": "1.0.0",
  "proof_id": "BOA01-B1",
  "goal": "A->B",
  "context": {
    "domain": "hilbert-benchmark-v1",
    "rule_pack": "classical-hilbert-v1",
    "syntax": "hilbert-prop-ascii-v1",
    "generator": "llm-benchmark-v1"
  },
  "assumptions": [
    "B"
  ],
  "steps": [
    {
      "kind": "assumption",
      "assumption_ref": 1,
      "formula": "B"
    },
    {
      "kind": "axiom",
      "axiom": "A1",
      "formula": "B->(A->B)"
    },
    {
      "kind": "modus_ponens",
      "premises": [
        1,
        2
      ],
      "formula": "A->B"
    }
  ]
}