{
  "certificate_version": "1.0.0",
  "proof_id": "GMF2B05-FG",
  "goal": "L",
  "assumptions": ["J", "J -> K", "K -> L"],
  "context": {
    "domain": "hilbert-benchmark-v1",
    "rule_pack": "classical-hilbert-v1",
    "syntax": "hilbert-prop-ascii-v1",
    "generator": "llm-benchmark-v1"
  },
  "steps": [
    {
      "kind": "assumption",
      "assumption_ref": 1,
      "formula": "J"
    },
    {
      "kind": "assumption",
      "assumption_ref": 2,
      "formula": "J -> K"
    },
    {
      "kind": "assumption",
      "assumption_ref": 3,
      "formula": "K -> L"
    },
    {
      "kind": "modus_ponens",
      "premises": [1, 2],
      "formula": "K"
    },
    {
      "kind": "modus_ponens",
      "premises": [4, 3],
      "formula": "L"
    }
  ]
}