{"certificate_version":"1.0.0","proof_id":"SGF04-FM-1","goal":"U","context":{"domain":"hilbert-benchmark-v1","rule_pack":"classical-hilbert-v1","syntax":"hilbert-prop-ascii-v1","generator":"llm-benchmark-v1"},"assumptions":["Y -> Z","Z -> U","Y"],"steps":[{"kind":"assumption","assumption_ref":1,"formula":"Y -> Z"},{"kind":"assumption","assumption_ref":2,"formula":"Z -> U"},{"kind":"assumption","assumption_ref":3,"formula":"Y"},{"kind":"modus_ponens","premises":[3,1],"formula":"Z"},{"kind":"modus_ponens","premises":[4,2],"formula":"U"}]}