{
  "certificate_version": "1.0.0",
  "proof_id": "GMF2A04-FG",
  "goal": "Y",
  "context": {
    "domain": "hilbert-benchmark-v1",
    "rule_pack": "classical-hilbert-v1",
    "syntax": "hilbert-prop-ascii-v1",
    "generator": "llm-benchmark-v1"
  },
  "assumptions": [
    "X",
    "X -> Y"
  ],
  "steps": [
    {
      "kind": "assumption",
      "formula": "X",
      "assumption_ref": 1
    },
    {
      "kind": "assumption",
      "formula": "X -> Y",
      "assumption_ref": 2
    },
    {
      "kind": "modus_ponens",
      "formula": "Y",
      "premises": [1, 2]
    }
  ]
}