{
  "certificate_version": "1.0.0",
  "proof_id": "SGF03-M1",
  "goal": "N",
  "assumptions": ["M", "M -> N"],
  "context": {
    "domain": "hilbert-benchmark-v1",
    "rule_pack": "classical-hilbert-v1",
    "syntax": "hilbert-prop-ascii-v1",
    "generator": "llm-benchmark-v1"
  },
  "steps": [
    {
      "kind": "assumption",
      "formula": "M",
      "assumption_ref": 1
    },
    {
      "kind": "assumption",
      "formula": "M -> N",
      "assumption_ref": 2
    },
    {
      "kind": "modus_ponens",
      "formula": "N",
      "premises": [1, 2]
    }
  ]
}