{"certificate_version":"1.0.0","proof_id":"bridge_import_final_research_phase1:BIF04-FG","goal":"!X -> Z","context":{"domain":"hilbert-benchmark-v1","rule_pack":"classical-hilbert-v1","syntax":"hilbert-prop-ascii-v1","generator":"llm-benchmark-v1"},"assumptions":["!X -> Y","Y -> Z"],"steps":[{"kind":"assumption","assumption_ref":1,"formula":"!X -> Y"},{"kind":"assumption","assumption_ref":2,"formula":"Y -> Z"},{"kind":"axiom","axiom":"A1","formula":"(Y -> Z) -> (!X -> (Y -> Z))"},{"kind":"modus_ponens","premises":[2,3],"formula":"!X -> (Y -> Z)"},{"kind":"axiom","axiom":"A2","formula":"(!X -> (Y -> Z)) -> ((!X -> Y) -> (!X -> Z))"},{"kind":"modus_ponens","premises":[4,5],"formula":"(!X -> Y) -> (!X -> Z)"},{"kind":"modus_ponens","premises":[1,6],"formula":"!X -> Z"}]}