{
  "certificate_version": "1.0.0",
  "proof_id": "GMF2B04-FG",
  "goal": "Z",
  "context": {
    "domain": "hilbert-benchmark-v1",
    "rule_pack": "classical-hilbert-v1",
    "syntax": "hilbert-prop-ascii-v1",
    "generator": "llm-benchmark-v1"
  },
  "assumptions": ["X", "X -> Y", "Y -> Z"],
  "steps": [
    {
      "kind": "assumption",
      "formula": "X",
      "assumption_ref": 1
    },
    {
      "kind": "assumption",
      "formula": "X -> Y",
      "assumption_ref": 2
    },
    {
      "kind": "modus_ponens",
      "formula": "Y",
      "premises": [1, 2]
    },
    {
      "kind": "assumption",
      "formula": "Y -> Z",
      "assumption_ref": 3
    },
    {
      "kind": "modus_ponens",
      "formula": "Z",
      "premises": [3, 4]
    }
  ]
}