{
  "certificate_version": "1.0.0",
  "proof_id": "GMF2D05-FG",
  "goal": "I",
  "context": {
    "domain": "hilbert-benchmark-v1",
    "rule_pack": "classical-hilbert-v1",
    "syntax": "hilbert-prop-ascii-v1",
    "generator": "llm-benchmark-v1"
  },
  "assumptions": [
    "J",
    "J -> K",
    "K -> L",
    "L -> I"
  ],
  "steps": [
    {
      "kind": "assumption",
      "assumption_ref": 1,
      "formula": "J"
    },
    {
      "kind": "assumption",
      "assumption_ref": 2,
      "formula": "J -> K"
    },
    {
      "kind": "modus_ponens",
      "premises": [1, 2],
      "formula": "K"
    },
    {
      "kind": "assumption",
      "assumption_ref": 3,
      "formula": "K -> L"
    },
    {
      "kind": "modus_ponens",
      "premises": [3, 4],
      "formula": "L"
    },
    {
      "kind": "assumption",
      "assumption_ref": 4,
      "formula": "L -> I"
    },
    {
      "kind": "modus_ponens",
      "premises": [5, 6],
      "formula": "I"
    }
  ]
}