{
  "certificate_version": "1.0.0",
  "proof_id": "SGF05-M1",
  "goal": "K",
  "assumptions": ["J", "J->K"],
  "context": {
    "domain": "hilbert-benchmark-v1",
    "rule_pack": "classical-hilbert-v1",
    "syntax": "hilbert-prop-ascii-v1",
    "generator": "llm-benchmark-v1"
  },
  "steps": [
    {
      "kind": "assumption",
      "formula": "J",
      "assumption_ref": 1
    },
    {
      "kind": "assumption",
      "formula": "J->K",
      "assumption_ref": 2
    },
    {
      "kind": "modus_ponens",
      "formula": "K",
      "premises": [1, 2]
    }
  ]
}