{"certificate_version":"1.0.0","proof_id":"pilot_shared_20260327_NDI01","goal":"P","context":{"domain":"hilbert-benchmark-v1","rule_pack":"classical-hilbert-v1","syntax":"hilbert-prop-ascii-v1","generator":"llm-benchmark-v1"},"assumptions":["P"],"steps":[{"kind":"assumption","assumption_ref":1,"formula":"P"}]}